{
  "$schema": "https://json-schema.org/draft/2020-12/schema",
  "title": "Revision",
  "description": "A revision to a post.",
  "$id": "https://raw.githubusercontent.com/api-evangelist/stackexchange/refs/heads/main/json-schema/stackexchange-api-v2-3-revision-schema.json",
  "type": "object",
  "properties": {
    "revision_guid": {
      "type": "string",
      "format": "uuid",
      "example": "9f1f1ad2-9bcb-4f0c-9eee-1234567890ab"
    },
    "revision_number": {
      "type": "integer",
      "example": 4
    },
    "revision_type": {
      "type": "string",
      "enum": [
        "single_user",
        "vote_based"
      ],
      "example": "single_user"
    },
    "post_type": {
      "type": "string",
      "enum": [
        "question",
        "answer"
      ],
      "example": "question"
    },
    "post_id": {
      "type": "integer",
      "example": 11227809
    },
    "comment": {
      "type": "string",
      "example": "Fixed typo"
    },
    "creation_date": {
      "type": "integer",
      "format": "int64",
      "example": 1338800000
    },
    "is_rollback": {
      "type": "boolean",
      "example": false
    },
    "last_body": {
      "type": "string"
    },
    "last_title": {
      "type": "string"
    },
    "last_tags": {
      "type": "array",
      "items": {
        "type": "string"
      }
    },
    "body": {
      "type": "string"
    },
    "title": {
      "type": "string"
    },
    "tags": {
      "type": "array",
      "items": {
        "type": "string"
      }
    },
    "set_community_wiki": {
      "type": "boolean"
    },
    "user": {
      "type": "object",
      "description": "Lightweight user reference embedded in posts and comments.",
      "properties": {
        "user_id": {
          "type": "integer",
          "format": "int64",
          "example": 22656
        },
        "user_type": {
          "type": "string",
          "enum": [
            "unregistered",
            "registered",
            "moderator",
            "team_admin",
            "does_not_exist"
          ],
          "example": "registered"
        },
        "display_name": {
          "type": "string",
          "example": "Jon Skeet"
        },
        "reputation": {
          "type": "integer",
          "example": 1500000
        },
        "profile_image": {
          "type": "string",
          "format": "uri",
          "example": "https://i.sstatic.net/lLZAr.jpg?s=128"
        },
        "link": {
          "type": "string",
          "format": "uri",
          "example": "https://stackoverflow.com/users/22656/jon-skeet"
        },
        "accept_rate": {
          "type": "integer",
          "example": 92
        }
      }
    }
  }
}